{
  "inputs": [
    {
      "bytes": 2747,
      "endpoint_id": "models",
      "file": "models.json",
      "sha256": "20786e394a164665a684522fd1e55f9ae2a0c0fb7f552060ad9b05aad05f22ef",
      "source_url": "https://openrouter.ai/api/v1/models"
    }
  ],
  "observed_at": "2026-07-18T00:00:00Z",
  "provider_id": "openrouter",
  "schema_version": 1
}
